{
  "storyId": "std1_ch1_story1",
  "pageNo": 1,
  "text": "рд╕реБрдмрд╣ рдХрд╛ рд╕рдордп рдерд╛ рдФрд░ рд╕рд╛рд░рд╛ рдЧрд╛рдВрд╡ рдЬрд╛рдЧ рд░рд╣рд╛ рдерд╛ред",
  "emoji": "ЁЯУШ",
  "narration": "audio/stories/std1_ch1/story1/page1.mp3",
  "vocab": [
    {"word": "рд╕реБрдмрд╣", "meaning": "morning", "emoji": "ЁЯМЕ", "audio": "audio/vocab/рд╕реБрдмрд╣.mp3"}
  ]
}
